<?xml version="1.0" encoding="UTF-8"?>
<mp3 xmlns:xsi="http://www.w3.org/2001/XMLSchema-instance"
    xsi:noNamespaceSchemaLocation="ammangus_project2-2.xsd">
    <artist artistname="Billie Eilish">
        <membersIFgroup groupORperson="person"/>
        <startcareer>2016</startcareer>
        <genre>pop</genre>
        <country>USA</country>
        <album albumname="When We All Fall Asleep, Where Do We Go?" albumtype="album"
            a_sku="K315F2020A" catagory="Grammy_Winner">
            <image>billie.jpg</image>
            <citation>theguardian.com</citation>
            <comment>wish u were gay is not about a girl, automatic -1</comment>
            <rating>7</rating>
            <producer>Finneas O'Connell</producer>
            <engineersmixers>Rob Kinelski &amp; Finneas O'Connell</engineersmixers>
            <songwriters>Billie Eilish O'Connell &amp; Finneas O'Connell</songwriters>
            <masteringengineer>John Greenham</masteringengineer>
            <a_label>interscope</a_label>
            <tracks>
                <track albumref="K315F2020A" type="song" t_sku="K315F2020A001">
                    <title>!!!!!!!</title>
                    <rankposition>1</rankposition>
                    <length>0:13</length>
                    <writers>Billie Eilish / Finneas O'Connell</writers>
                </track>
                <track albumref="K315F2020A" type="song" t_sku="K315F2020A002">
                    <title>bad guy</title>
                    <rankposition>2</rankposition>
                    <length>3:14</length>
                    <writers>Billie Eilish / Finneas O'Connell</writers>
                </track>
                <track albumref="K315F2020A" type="song" t_sku="K315F2020A003">
                    <title>xanny</title>
                    <rankposition>3</rankposition>
                    <length>4:03</length>
                    <writers>Billie Eilish / Finneas O'Connell</writers>
                </track>
                <track albumref="K315F2020A" type="song" t_sku="K315F2020A004">
                    <title>you should see me in a crown</title>
                    <rankposition>4</rankposition>
                    <length>3:00</length>
                    <writers>Billie Eilish / Finneas O'Connell</writers>
                </track>
                <track albumref="K315F2020A" type="song" t_sku="K315F2020A005">
                    <title>all the good girls go to hell</title>
                    <rankposition>5</rankposition>
                    <length>2:48</length>
                    <writers>Billie Eilish / Finneas O'Connell</writers>
                </track>
                <track albumref="K315F2020A" type="song" t_sku="K315F2020A006">
                    <title>wish you were gay</title>
                    <rankposition>6</rankposition>
                    <length>3:41</length>
                    <writers>Finneas O'Connell</writers>
                </track>
                <track albumref="K315F2020A" type="song" t_sku="K315F2020A007">
                    <title>when the party's over</title>
                    <rankposition>7</rankposition>
                    <length>3:16</length>
                    <writers>Billie Eilish / Finneas O'Connell</writers>
                </track>
                <track albumref="K315F2020A" type="song" t_sku="K315F2020A008">
                    <title>8</title>
                    <rankposition>8</rankposition>
                    <length>2:53</length>
                    <writers>Billie Eilish / Finneas O'Connell</writers>
                </track>
                <track albumref="K315F2020A" type="song" t_sku="K315F2020A009">
                    <title>my strange addiction</title>
                    <rankposition>9</rankposition>
                    <length>2:59</length>
                    <writers>Finneas O'Connell</writers>
                </track>
                <track albumref="K315F2020A" type="song" t_sku="K315F2020A010">
                    <title>bury a friend</title>
                    <rankposition>10</rankposition>
                    <length>3:13</length>
                    <writers>Billie Eilish / Finneas O'Connell</writers>
                </track>
                <track albumref="K315F2020A" type="song" t_sku="K315F2020A011">
                    <title>ilomilo</title>
                    <rankposition>11</rankposition>
                    <length>2:36</length>
                    <writers>Billie Eilish / Finneas O'Connell</writers>
                </track>
                <track albumref="K315F2020A" type="song" t_sku="K315F2020A012">
                    <title>listen before i go</title>
                    <rankposition>12</rankposition>
                    <length>4:02</length>
                    <writers>Billie Eilish / Finneas O'Connell</writers>
                </track>
                <track albumref="K315F2020A" type="song" t_sku="K315F2020A013">
                    <title>i love you</title>
                    <rankposition>13</rankposition>
                    <length>4:51</length>
                    <writers>Billie Eilish / Finneas O'Connell</writers>
                </track>
                <track albumref="K315F2020A" type="song" t_sku="K315F2020A014">
                    <title>goodbye</title>
                    <rankposition>14</rankposition>
                    <length>1:59</length>
                    <writers>Billie Eilish / Finneas O'Connell</writers>
                </track>
            </tracks>
            <releases>
                <release>
                    <date>2019-03-29</date>
                    <r_label>Darkroom, Interscope Records</r_label>
                    <r_catalogue_number>B0029727-02</r_catalogue_number>
                    <r_barcode>602577427626</r_barcode>
                    <format>CD</format>
                    <r_country>AU</r_country>
                </release>
                <release>
                    <date>2019-03-29</date>
                    <r_label>Interscope Records, Darkroom</r_label>
                    <r_catalogue_number>B0029729-01, B0029729-01JK02</r_catalogue_number>
                    <r_barcode>602577427664</r_barcode>
                    <format>12" Vinyl</format>
                    <r_country>CA, US</r_country>
                </release>
                <release>
                    <date>2019-03-29</date>
                    <r_label>Darkroom, Interscope Records</r_label>
                    <r_catalogue_number>602577427626</r_catalogue_number>
                    <r_barcode>602577427626</r_barcode>
                    <format>CD</format>
                    <r_country>XE</r_country>
                </release>
                <release>
                    <date>2019-03-29</date>
                    <r_label>Darkroom, Interscope Records</r_label>
                    <r_catalogue_number>602577588037</r_catalogue_number>
                    <r_barcode>602577427664</r_barcode>
                    <format>12" Vinyl</format>
                    <r_country>IE, GB</r_country>
                </release>

                <release>
                    <date>2019-03-29</date>
                    <r_label>Interscope Records</r_label>
                    <r_catalogue_number>UICS-1350</r_catalogue_number>
                    <r_barcode>4988031321645</r_barcode>
                    <format>CD</format>
                    <r_country>JP</r_country>
                </release>
                <release>
                    <date>2019-03-29</date>
                    <r_label>Darkroom, Interscope Records</r_label>
                    <r_catalogue_number>B0029727-02</r_catalogue_number>
                    <r_barcode>602577427626</r_barcode>
                    <format>CD</format>
                    <r_country>GB</r_country>
                </release>
                <release>
                    <date>2019-03-29</date>
                    <r_label>Darkroom, Interscope Records</r_label>
                    <r_catalogue_number>[none]</r_catalogue_number>
                    <r_barcode>602508481703</r_barcode>
                    <format>Digital Media</format>
                    <r_country>US</r_country>
                </release>
                <release>
                    <date>2019-03-29</date>
                    <r_label>Darkroom, Interscope Records</r_label>
                    <r_catalogue_number>B0029727-02</r_catalogue_number>
                    <r_barcode>602577427626</r_barcode>
                    <format>CD</format>
                    <r_country>US</r_country>
                </release>
                <release>
                    <date>2019-03-29</date>
                    <r_label>Darkroom, Interscope Records</r_label>
                    <r_catalogue_number/>
                    <r_barcode>602577427640</r_barcode>
                    <format>Digital Media</format>
                    <r_country>XW</r_country>
                </release>
                <release>
                    <date>2019-03-29</date>
                    <r_label>Darkroom, Interscope Records</r_label>
                    <r_catalogue_number/>
                    <r_barcode>602577427657</r_barcode>
                    <format>Digital Media</format>
                    <r_country>XW</r_country>
                </release>
                <release>
                    <date>2019-12-09</date>
                    <r_label>Darkroom, Interscope Records</r_label>
                    <r_catalogue_number>B0031217-1</r_catalogue_number>
                    <r_barcode>602508310270</r_barcode>
                    <format>7x7" Vinyl</format>
                    <r_country>US, XE</r_country>
                </release>


                <release>
                    <date>2019-12-13</date>
                    <r_label>Darkroom, Interscope Records</r_label>
                    <r_catalogue_number>602508556517</r_catalogue_number>